genre_ids,original_language,original_title,overview,release_date,title,vote_average
"[80, 18]",en,The Racket,A renegade police captain sets out to catch a sadistic mob boss.,1928-11-01,The Racket,6.4
"[18, 10749]",en,7th Heaven,A dejected Parisian sewer worker feels his prayers have been answered when he falls in love with a street waif.,1927-09-10,7th Heaven,7.317
"[18, 28, 10752, 10749]",en,Wings,"Two young men, one rich, one middle class, both in love with the same woman, become US Air Corps fighter pilots and, eventually, heroic flying aces during World War I. Devoted best friends, their mutual love of the girl eventually threatens their bond. Meanwhile, a hometown girl who's the lovestruck lifelong next door neighbor of one of them pines away.",1927-08-12,Wings,7.198
"[28, 80, 53]",en,Alibi,"Chick Williams, a prohibition gangster, rejoins his mob soon after being released from prison. When a policeman is murdered during a robbery, he falls under suspicion. The gangster took Joan, a policeman's daughter, to the theater, sneaked out during the intermission to commit the crime, then used her to support his alibi. The detective squad employs its most sophisticated and barbaric techniques, including planting an undercover agent in the gang, to bring him to justice.",1929-04-20,Alibi,5.656
"[28, 37]",en,In Old Arizona,"Army Sergeant Mickey Dunn sets out in pursuit of the Cisco Kid, a notorious if kind-hearted and charismatic bandit of the Old West. The Kid spends much of his loot on Tonia, the woman he loves, not realizing that she is being unfaithful to him in his absence. Soon, with her oblivious paramour off plying his trade, Tonia falls in with Dunn, drawn by the allure of a substantial reward for the Kid's capture -- dead or alive. Together, they concoct a plan to ambush and do away with the Cisco Kid once and for all.",1928-12-25,In Old Arizona,5.208
"[10402, 10749, 18]",en,The Broadway Melody,"The vaudeville act of Harriet and Queenie Mahoney comes to Broadway, where their friend Eddie Kerns needs them for his number in one of Francis Zanfield's shows. When Eddie meets Queenie, he soon falls in love with  her—but she is already being courted by Jock Warriner, a member of New York high society. Queenie eventually recognizes that, to Jock, she is nothing more than a toy, and that Eddie is in love with her.",1929-02-08,The Broadway Melody,5.194
"[35, 10402]",en,The Hollywood Revue of 1929,An all-star revue featuring MGM contract players.,1929-11-23,The Hollywood Revue of 1929,5.583
[18],en,The Patriot,"In 18th-Century Russia, the Czar, Paul, is surrounded by murderous plots and trusts only Count Pahlen. Pahlen wishes to protect his friend, the mad king, but because of the horror of the king's acts, he feels that he must remove him from the throne.",1928-09-01,The Patriot,5.0
"[18, 10752]",en,All Quiet on the Western Front,"A young soldier faces profound disillusionment in the soul-destroying horror of World War I. Together with several other young German soldiers, he experiences the horrors of war, such evil of which he had not conceived of when signing up to fight. They eventually become sad, tormented, and confused of their purpose.",1930-04-29,All Quiet on the Western Front,7.736
"[80, 18]",en,The Big House,"Convicted of manslaughter for a drunken driving accident, Kent Marlowe is sent to prison, where he meets vicious incarcerated figures who are planning an escape from the brutal conditions.",1930-06-14,The Big House,6.75
"[18, 36]",en,Disraeli,Prime Minister of Great Britain Benjamin Disraeli outwits the subterfuge of the Russians and chicanery at home in order to secure the purchase of the Suez Canal.,1929-11-01,Disraeli,5.438
"[18, 10749]",en,The Divorcee,"When a woman discovers that her husband has been unfaithful to her, she decides to respond to his infidelities in kind.",1930-04-19,The Divorcee,6.322
"[35, 10749]",en,The Love Parade,"The queen of mythical Sylvania marries a courtier, who finds his new life unsatisfying.",1930-01-18,The Love Parade,6.464
"[18, 37, 36]",en,Cimarron,"When the government opens up the Oklahoma territory for settlement, restless Yancey Cravat claims a plot of the free land for himself and moves his family there from Wichita. A newspaperman, lawyer, and just about everything else, Cravat soon becomes a leading citizen of the boom town of Osage. Once the town is established, however, he begins to feel confined once again, and heads for the Cherokee Strip, leaving his family behind. During this and other absences, his wife Sabra must learn to take care of herself and soon becomes prominent in her own right.",1931-01-26,Cimarron,5.473
[18],en,East Lynne,"The refined Lady Isabel Carlisle, after leaving her family and enduring nearly a decade of hardships, learns that her son has fallen ill. Despite being nearly blinded as the result of an explosion, she returns home to see her son again.",1931-03-01,East Lynne,5.889
"[35, 80, 18, 10749]",en,The Front Page,"Hildy Johnson is an investigative reporter is looking for a bigger paycheck. When an accused murderer escapes from custody, Hildy sees an opportunity for the story of a lifetime. But when he finds the criminal, he learns that the man may not be guilty. With the help of his editor, Hildy attempts to hide the convict, uncover the conspiracy and write the scoop of his career.",1931-04-04,The Front Page,6.5
"[18, 10751, 35]",en,Skippy,"Skippy, the mischievous son of a wealthy doctor, meets Sooky in poverty-ridden Shantytown, and together they try to save Sooky's pet from a cruel dogcatcher.",1931-04-25,Skippy,6.176
"[28, 12]",en,Trader Horn,"While on safari in an unexplored area of Africa, Trader Horn and Peru find missionary Edith Trent killed by natives. They decide to carry on her quest for her lost daughter Nina. They find her as the queen of a particularly savage tribe, and try to bring her back to civilization.",1931-02-03,Trader Horn,5.25
[18],en,Arrowsmith,"A medical researcher is sent to a plague outbreak, where he has to decide priorities for the use of a vaccine.",1931-12-07,Arrowsmith,6.591
"[10749, 18]",en,Bad Girl,"A man and woman, skeptical about romance, nonetheless fall in love and are wed, but their lack of confidence in the opposite sex haunts their marriage.",1931-08-13,Bad Girl,5.852
[18],en,The Champ,A broken-down alcoholic prizefighter struggles to keep custody of his adoring son.,1931-11-21,The Champ,7.0
"[80, 18]",en,Five Star Final,"Searching for headlines at any cost, an unscrupulous newspaper owner forces his editor to print a serial based on a past murder, tormenting a woman involved.",1931-09-26,Five Star Final,6.741
"[18, 10749]",en,Grand Hotel,"Guests at a posh Berlin hotel struggle through worry, scandal, and heartache.",1932-05-25,Grand Hotel,6.96
"[35, 10749]",en,One Hour with You,"Andre and Colette Bertier are happily married. When Colette introduces her husband to her flirtatious best friend, Mitzi, he does his best to resist her advances. But she is persistent, and very cute, and he succumbs. Mitzi's husband wants to divorce her, and has been having her tailed. Andre gets caught, and must confess to his wife. But Colette has had problems resisting the attentions of another man herself, and they forgive each other.",1932-03-23,One Hour with You,6.509
"[12, 18, 10749, 80, 36, 10752]",en,Shanghai Express,A beautiful temptress re-kindles an old romance while trying to escape her past during a tension-packed train journey.,1932-02-12,Shanghai Express,6.895
"[35, 10749]",en,The Smiling Lieutenant,"A simple wink, intended by Austrian palace guard Lt. Nikolaus von Preyn for girlfriend, Franzi, is accidentally intercepted -- and misread -- by the visiting Princess Anna. As a result, the soldier has no choice but to marry the royal lady and move with her to the neighboring kingdom of Flausenthurm. His girlfriend follows to continue the romance and, subversively, give Princess Anna tips on how to keep her husband satisfied.",1931-08-01,The Smiling Lieutenant,7.0
"[18, 10752]",en,Cavalcade,"A cavalcade of English life from New Year's Eve 1899 until 1933 is seen through the eyes of well-to-do Londoners Jane and Robert Marryot. Amongst events touching their family are the Boer War, the death of Queen Victoria, the sinking of the Titanic, and the Great War.",1933-02-08,Cavalcade,5.515
"[18, 10749, 10752]",en,A Farewell to Arms,"A tale of the World War I love affair, begun in Italy, between American ambulance driver Lt. Frederic Henry and British nurse Catherine Barkley. Eventually separated by Frederic's transfer, tremendous challenges and difficult decisions face each as the war rages on.",1932-12-08,A Farewell to Arms,6.254
"[35, 18, 10749]",en,42nd Street,"A producer puts on what may be his last Broadway show, and at the last moment a chorus girl has to replace the star.",1933-03-11,42nd Street,6.88
"[80, 18]",en,I Am a Fugitive from a Chain Gang,A World War I veteran’s dreams of becoming a master architect evaporate in the cold light of economic realities. Things get even worse when he’s falsely convicted of a crime and sent to work on a chain gang.,1932-11-09,I Am a Fugitive from a Chain Gang,7.822
"[35, 18]",en,Lady for a Day,"Never-wed, poor, rough around the edges Apple Annie has always written to her daughter, Louise, in Spain that she is married and a member of New York's high society. Upon receiving unexpected word from Louise (who hasn't seen Annie since infancy) that she is en route to America with her new fiancé and his father, a count, so the three of them can meet her, Annie panics, despairing that her beloved daughter will be destroyed by the deception.",1933-09-13,Lady for a Day,7.141
"[18, 10751]",en,Little Women,"Little Women is a coming-of-age drama tracing the lives of four sisters: Meg, Jo, Beth and Amy. During the American Civil War, the girls father is away serving as a minister to the troops. The family, headed by their beloved Marmee, must struggle to make ends meet, with the help of their kind and wealthy neighbor, Mr. Laurence, and his high spirited grandson Laurie.",1933-11-24,Little Women,6.7
"[36, 18]",en,The Private Life of Henry VIII,"Renowned for his excess, King Henry VIII goes through a series of wives during his rule. With Anne Boleyn, his second wife, executed on charges of treason, King Henry weds maid Jane Seymour, but that marriage also ends in tragedy. Not one to be single for long, the king picks German-born Anne of Cleves as his bride, but their union lasts only months before an annulment is granted, and King Henry continues his string of spouses.",1933-08-17,The Private Life of Henry VIII,6.299
"[35, 80]",en,She Done Him Wrong,"New York singer and nightclub owner Lady Lou has more men friends than you can imagine. One of them is a vicious criminal who’s escaped and is on the way to see “his” girl, not realising she hasn’t exactly been faithful in his absence. Help is at hand in the form of young Captain Cummings, a local temperance league leader.",1933-02-09,She Done Him Wrong,5.8
"[18, 10749]",en,Smilin' Through,"On the day of his wedding, Sir John Carteret's fiancée, Moonyeen, is killed by a jealous rival named Jeremy, leaving him emotionally devastated. Carteret spends three decades in seclusion, mostly communing with the spirit of Moonyeen, until he learns that her niece, Kathleen, has become an orphan. He adopts and raises the child as his own but is alarmed when, as a young woman, she falls in love with the son of Moonyeen's murderer.",1932-09-24,Smilin' Through,6.6
"[35, 18, 10749]",en,State Fair,"The children of Iowa farmers find love, with mixed results, at the state fair.",1933-02-10,State Fair,6.2
"[18, 10749]",en,The Barretts of Wimpole Street,"Remarkable poet Elizabeth Barrett is slowly recovering from a crippling illness with the help of her siblings, especially her youngest sister, Henrietta, but feels stifled by the domestic tyranny of her wealthy widowed father. When she meets fellow poet Robert Browning in a romantic first encounter, her heart belongs to him. However, her controlling father has no intention of allowing her out of his sight.",1934-09-21,The Barretts of Wimpole Street,6.188
"[36, 18, 10749]",en,Cleopatra,The queen of Egypt barges the Nile and flirts with Mark Antony and Julius Caesar.,1934-10-05,Cleopatra,6.0
"[10402, 10749]",en,Flirtation Walk,"A private stationed in Hawaii gets involved with the general's engaged daughter. In order to avoid a scandal, the pair break up, but meet again years later when he's at West Point producing the annual play that turns out to star her.",1934-12-01,Flirtation Walk,5.4
"[35, 10749]",en,The Gay Divorcee,"Seeking a divorce from her absentee husband, Mimi Glossop travels to an English seaside resort. There she falls in love with dancer Guy Holden, whom she later mistakes for the corespondent her lawyer hired.",1934-10-12,The Gay Divorcee,6.862
"[10752, 18]",en,Here Comes the Navy,A cocky guy joins the Navy for the wrong reason but finds romance and twice is cited for heroism.,1934-07-21,Here Comes the Navy,5.813
"[18, 36]",en,The House of Rothschild,"The story of the rise of the Rothschild financial empire founded by Mayer Rothschild and continued by his five sons. From humble beginnings the business grows and helps to finance the war against Napoleon, but it's not always easy, especially because of the prejudices against Jews.",1934-04-07,The House of Rothschild,6.067
"[18, 10749]",en,Imitation of Life,"A struggling widow and her daughter take in a black housekeeper and her fair-skinned daughter. The two women start a successful business but face familial, identity, and racial issues along the way.",1934-11-23,Imitation of Life,7.006
"[35, 10749]",en,It Happened One Night,"A renegade reporter and a young heiress meet on a bus heading for New York, and end up stuck with each other when the bus leaves them behind at one of the stops.",1934-02-22,It Happened One Night,7.844
"[10402, 10749]",en,One Night of Love,"Mary Barrett is an aspiring opera singer who is taken under the wings of a famous operatic maestro, Guilio Monterverdi. After spending endless working hours together and arguing, their relationship develops into love. But, jealousy and misunderstandings prevent Mary and Guilio from acknowledging their true feelings.",1934-07-16,One Night of Love,5.7
"[35, 80, 9648]",en,The Thin Man,A husband and wife detective team takes on the search for a missing inventor and almost get killed for their efforts.,1934-05-25,The Thin Man,7.501
[37],en,Viva Villa!,"In this fictionalized biography, young Pancho Villa takes to the hills after killing an overseer in revenge for his father's death.",1934-04-27,Viva Villa!,6.316
[18],en,The White Parade,"The title represents the hopeful, ambitious students at a hospital training school and is primarily a story of the stern discipline and laborious physical and mental toil they endure in order to become nurses and join the White Parade. It is told mainly through the character of June Arden who finds romance with Ronald Hall III on the way, with side stories of the other girls who find failure, success, laughs and tears on the way.",1934-11-16,The White Parade,6.0
"[35, 18, 10749]",en,Alice Adams,"In the lower-middle-class Adams family, father and son are happy to work in a drugstore, but mother and daughter Alice try every possible social-climbing stratagem despite snubs and embarrassment. When Alice finally meets her dream man Arthur, mother nags father into a risky business venture and plans to impress Alice's beau with an ""upscale"" family dinner. Will the excruciating results drive Arthur away?",1935-08-23,Alice Adams,6.7
"[10402, 10749]",en,Broadway Melody of 1936,"Lovely, gifted Irene Foster hopes that her childhood sweetheart-turned Broadway producer Robert Gordon will recognize her--and her talent. Gordon is too busy sparring with a dirt-dishing gossip columnist to notice, but his wisecracking, heart-of-gold secretary certainly does. She and Irene must use their wits to show him what he's missing!",1935-09-18,Broadway Melody of 1936,6.353
"[12, 28, 36, 10749]",en,Captain Blood,"Dr. Peter Blood, unjustly convicted of treason and exiled from England, becomes a notorious pirate.",1935-12-26,Captain Blood,7.25
"[12, 18, 10749, 10751]",en,"The Personal History, Adventures, Experience, & Observation of David Copperfield the Younger","Charles Dickens' timeless tale of an ordinary young man who lives an extraordinary life, filled with people who help and hinder him.",1935-01-18,David Copperfield,6.6
"[80, 18]",en,The Informer,"Gypo Nolan is a former Irish Republican Army man who drowns his sorrows in the bottle. He's desperate to escape his bleak Dublin life and start over in America with his girlfriend. So when British authorities advertise a reward for information about his best friend, current IRA member Frankie, Gypo cooperates. Now Gypo can buy two tickets on a boat bound for the States, but can he escape the overwhelming guilt he feels for betraying his buddy?",1935-05-09,The Informer,6.756
"[18, 36]",fr,Les Misérables,"The lives of numerous people over the course of 20 years in 19th century France, weaved together by the story of an ex-convict named Jean Valjean on the run from an obsessive police inspector, who pursues him for only a minor offense.",1934-02-09,Les Misérables,7.798
"[12, 18, 10752]",en,The Lives of a Bengal Lancer,"In the Northwest Frontier of India, the 41st Bengal Lancers leaded by the harsh Colonel Tom Stone are having trouble with the rebellious leader Mohammed Khan. After two casualties, the experienced but insubordinate Lieutenant Alan McGregor receives as replacement, the arrogant Lieutenant Forsythe and the immature son of Colonel Stone, Lieutenant Donald Stone. With the intention to prove that he will not have any privilege in the troop, the reception of Colonel Stone to his son is absolutely cold, but he becomes the protégé of McGregor. When Lieutenant Stone is kidnapped by Mohammed Khan, McGregor and Forsythe disobey the direct order of their commander, disguise as Indian peddlers and go to Khan's fortress to attempt to rescue their friend.",1935-01-11,The Lives of a Bengal Lancer,6.75
"[14, 10749, 35]",en,A Midsummer Night's Dream,"Four young people escape Athens to a forest where the king and queen of the fairies are quarreling, while meanwhile, a troupe of amateur actors rehearses a play. When the fairy Puck uses a magic flower to make people fall in love, the whole thing becomes a little bit confused...",1935-10-09,A Midsummer Night's Dream,6.686
"[12, 18, 36]",en,Mutiny on the Bounty,"Fletcher Christian successfully leads a revolt against the ruthless Captain Bligh on the HMS Bounty. However, Bligh returns one year later, hell bent on revenge.",1935-11-22,Mutiny on the Bounty,7.3
"[10402, 10749, 18]",en,Naughty Marietta,"A French princess flees an arranged marriage and sails for New Orleans, where she is rescued from pirates by a dashing mercenary.",1935-03-29,Naughty Marietta,4.214
[35],en,Ruggles of Red Gap,"In this comedy of an Englishman stranded in a sea of barbaric Americans, Marmaduke Ruggles, a gentleman's gentleman and butler to an Earl is lost in a poker game to an uncouth American cattle baron. Ruggles's life is turned upside down as he's taken to the USA, is gradually assimilated into American life, accidently becomes a local celebrity, and falls in love along the way.",1935-03-08,Ruggles of Red Gap,7.016
"[35, 10402, 10749]",en,Top Hat,"Showman Jerry Travers is working for producer Horace Hardwick in London. Jerry demonstrates his new dance steps late one night in Horace's hotel room, much to the annoyance of sleeping Dale Tremont below. She goes upstairs to complain and the two are immediately attracted to each other. Complications arise when Dale mistakes Jerry for Horace.",1935-08-29,Top Hat,7.3
"[18, 10749, 12, 36]",en,Anthony Adverse,"Based on the novel by Hervey Allen, this expansive drama follows the many adventures of the eponymous hero, Anthony Adverse. Abandoned at a convent by his heartless nobleman father, Don Luis, Anthony is later mentored by his kind grandfather, John Bonnyfeather, and falls for the beautiful Angela Giuseppe. When circumstances separate Anthony and Angela and he embarks on a long journey, he must find his way back to her, no matter what the cost.",1936-08-26,Anthony Adverse,5.935
"[18, 10749]",en,Dodsworth,A retired auto manufacturer and his wife take a long-planned European vacation only to find that they want very different things from life.,1936-09-23,Dodsworth,7.159
"[18, 10402, 10749]",en,The Great Ziegfeld,"Lavish biography of Flo Ziegfeld, the producer who became Broadway's biggest starmaker.",1936-04-08,The Great Ziegfeld,6.221
"[35, 10749]",en,Libeled Lady,"When a major newspaper accuses wealthy socialite Connie Allenbury of being a home-wrecker, and she files a multi-million-dollar libel lawsuit, the publication's frazzled head editor, Warren Haggerty, must find a way to turn the tables on her. Soon Haggerty's harried fiancée, Gladys Benton, and his dashing friend Bill Chandler are in on a scheme that aims to discredit Connie, with amusing and unexpected results.",1936-10-09,Libeled Lady,7.313
"[35, 18, 10749]",en,Mr. Deeds Goes to Town,"Longfellow Deeds lives in a small town, leading a small town kind of life. When a relative dies and leaves Deeds a fortune, Longfellow moves to the big city where he becomes an instant target for everyone. Deeds outwits them all until Babe Bennett comes along. When small-town boy meets big-city girl anything can, and does, happen.",1936-04-09,Mr. Deeds Goes to Town,7.486
"[18, 10749]",en,Romeo and Juliet,Young love is poisoned by a generations long feud between two noble families.,1936-09-03,Romeo and Juliet,5.979
"[18, 10402, 10749]",en,San Francisco,A beautiful singer and a battling priest try to reform a Barbary Coast saloon owner in the days before the great earthquake and subsequent fires in 1906.,1936-06-26,San Francisco,6.719
"[18, 36]",en,The Story of Louis Pasteur,"A true story about Louis Pasteur, who revolutionized medicine by proving that much disease is caused by microbes, that sanitation is paramount and that at least some diseases can be cured by vaccinations.",1936-02-22,The Story of Louis Pasteur,6.789
"[36, 10749, 18]",en,A Tale of Two Cities,"The exciting story of Dr. Manette, who escapes the horrors of the infamous Bastille prison in Paris. The action switches between London and Paris on the eve of the revolution where we witness 'the best of times and the worst of times' - love, hope, the uncaring French Aristocrats and the terror of a revolutionary citizen's army intent on exacting revenge.",1935-12-25,A Tale of Two Cities,6.712
"[35, 10749, 10402]",en,Three Smart Girls,"The three Craig sisters Penny, Kay, and Joan, go to New York to stop their divorced father from marrying gold digger Donna Lyons and re-unite him with their mother.",1936-12-20,Three Smart Girls,6.4
"[35, 10749]",en,The Awful Truth,"Unfounded suspicions lead a married couple to begin divorce proceedings, whereupon they start undermining each other's attempts to find new romance.",1937-10-20,The Awful Truth,7.262
"[12, 18, 10751]",en,Captains Courageous,"Harvey, the arrogant and spoiled son of an indulgent absentee-father, falls overboard from a transatlantic steamship and is rescued by a fishing vessel on the Grand Banks. Harvey fails to persuade them to take him ashore, nor convince the crew of his wealth. The captain offers him a low-paid job, until they return to port, as part of the crew that turns him into a mature, considerate young man.",1937-06-25,Captains Courageous,7.4
"[80, 18]",en,Dead End,"Mobster ""Baby Face"" Martin returns home to visit the New York neighborhood where he grew up, dropping in on his mother, who rejects him because of his gangster lifestyle, and his old girlfriend, Francey, now a syphilitic prostitute. Martin also crosses paths with Dave, a childhood friend struggling to make it as an architect, and the Dead End Kids, a gang of young boys roaming the streets of the city's East Side slums.",1937-08-27,Dead End,6.941
"[18, 36, 10749]",en,The Good Earth,"China, during the rule of the Qing Dynasty. The arranged marriage between Wang Lung, a humble farmer, and O-Lan, a domestic slave, will endure the many hardships of life over the years; but the temptations of a fragile prosperity will endanger their love and the survival of their entire family.",1937-06-02,The Good Earth,6.205
"[28, 18]",en,In Old Chicago,"The O'Leary brothers -- honest Jack and roguish Dion -- become powerful figures, and eventually rivals, in Chicago on the eve of its Great Fire.",1938-04-15,In Old Chicago,6.441
"[18, 36]",en,The Life of Emile Zola,Biopic of the famous French writer Emile Zola and his involvement in the Dreyfus Affair.,1937-09-09,The Life of Emile Zola,6.581
"[12, 14, 18, 10749]",en,Lost Horizon,"British diplomat Robert Conway and a small group of civilians crash land in the Himalayas, and are rescued by the people of the mysterious, Eden-like valley of Shangri-la. Protected by the mountains from the world outside, where the clouds of World War II are gathering, Shangri-la provides a seductive escape for the world-weary Conway.",1937-03-03,Lost Horizon,7.068
"[35, 18, 10402]",en,One Hundred Men and a Girl,"The daughter of a struggling musician forms a symphony orchestra made up of his unemployed friends and through persistence, charm and a few misunderstandings, is able to get Leopold Stokowski to lead them in a concert that leads to a radio contract.",1937-09-05,One Hundred Men and a Girl,6.3
