genre_ids,original_language,original_title,overview,release_date,title,vote_average
"[35, 18, 10749]",en,Annie Hall,New York comedian Alvy Singer falls in love with the ditsy Annie Hall.,1977-04-19,Annie Hall,7.756
"[35, 18, 10749]",en,The Goodbye Girl,"After being dumped by her live-in boyfriend, an unemployed dancer and her 10-year-old daughter are reluctantly forced to live with a struggling off-Broadway actor.",1977-11-27,The Goodbye Girl,6.891
[18],en,Julia,"At the behest of an old and dear friend, playwright Lillian Hellman undertakes a dangerous mission to smuggle funds into Nazi Germany.",1977-10-01,Julia,6.601
"[12, 28, 878]",en,Star Wars,Princess Leia is captured and held hostage by the evil Imperial forces in their effort to take over the galactic Empire. Venturesome Luke Skywalker and dashing captain Han Solo team together with the loveable robot duo R2-D2 and C-3PO to rescue the beautiful princess and restore peace and justice in the Empire.,1977-05-25,Star Wars,8.205
"[18, 10749]",en,The Turning Point,"As young dancers, they were best friends and fierce rivals. Deedee left the stage for marriage and motherhood, while Emma would become an international ballet icon. But when Deedee's teenage daughter is invited to join Emma's dance company and begins an affair with a young Russian star, the two women are forced to confront the choices they've made, the resentments they've hidden and the emotional truths they must face at the turning point.",1977-11-14,The Turning Point,6.5
"[18, 10749, 10752]",en,Coming Home,"The wife of a Marine serving in Vietnam, Sally Hyde decides to volunteer at a local veterans hospital to occupy her time. There she meets Luke Martin, a frustrated wheelchair-bound vet who has become disillusioned with the war. Sally and Luke develop a friendship that soon turns into a romance.",1978-02-15,Coming Home,7.006
"[18, 10752]",en,The Deer Hunter,"A group of working-class friends decide to enlist in the Army during the Vietnam War and finds it to be hellish chaos -- not the noble venture they imagined. Before they left, Steven married his pregnant girlfriend -- and Michael and Nick were in love with the same woman. But all three are different men upon their return.",1978-12-08,The Deer Hunter,8.002
"[14, 35, 10749]",en,Heaven Can Wait,"Joe Pendleton is a quarterback preparing to lead his team to the superbowl when he is almost killed in an accident. An overanxious angel plucks him to heaven only to discover that he wasn't ready to die, and that his body has been cremated. A new body must be found, and that of a recently-murdered millionaire is chosen. His wife and accountant—the murderers—are confused by this development, as he buys the L.A. Rams in order to once again quarterback them into the Superbowl.",1978-06-28,Heaven Can Wait,6.562
"[18, 80]",en,Midnight Express,"Billy Hayes is caught attempting to smuggle drugs out of Turkey. The Turkish courts decide to make an example of him, sentencing him to more than 30 years in prison. Hayes has two opportunities for release: the appeals made by his lawyer, his family, and the American government, or the ""Midnight Express"".",1978-08-31,Midnight Express,7.517
"[18, 10749, 35]",en,An Unmarried Woman,A wealthy woman from Manhattan's Upper East Side struggles to deal with her new identity and her sexuality after her husband of 16 years leaves her for a younger woman.,1978-05-24,An Unmarried Woman,6.6
[18],en,All That Jazz,"Joe Gideon is at the top of the heap, one of the most successful directors and choreographers in musical theater. But he can feel his world slowly collapsing around him - his obsession with work has almost destroyed his personal life, and only his bottles of pills keep him going.",1979-12-16,All That Jazz,7.459
"[18, 10752]",en,Apocalypse Now,"At the height of the Vietnam war, Captain Benjamin Willard is sent on a dangerous mission that, officially, ""does not exist, nor will it ever exist."" His goal is to locate - and eliminate - a mysterious Green Beret Colonel named Walter Kurtz, who has been leading his personal army on illegal guerrilla missions into enemy territory.",1979-08-15,Apocalypse Now,8.281
"[18, 35]",en,Breaking Away,"Dave, nineteen, has just graduated high school, with his 3 friends, The comical Cyril, the warm hearted but short-tempered Moocher, and the athletic, spiteful but good-hearted Mike. Now, Dave enjoys racing bikes and hopes to race the Italians one day, and even takes up the Italian culture, much to his friends and parents annoyance.",1979-05-24,Breaking Away,7.086
[18],en,Kramer vs. Kramer,"Ted Kramer is a career man for whom his work comes before his family. His wife Joanna cannot take this anymore, so she decides to leave him. Ted is now faced with the tasks of housekeeping and taking care of himself and their young son Billy.",1979-12-07,Kramer vs. Kramer,7.558
[18],en,Norma Rae,"Norma Rae is a southern textile worker employed in a factory with intolerable working conditions. This concern about the situation gives her the gumption to be the key associate to a visiting labor union organizer. Together, they undertake the difficult, and possibly dangerous, struggle to unionize her factory.",1979-03-02,Norma Rae,7.191
"[10402, 18]",en,Coal Miner's Daughter,"Biography of Loretta Lynn, a country and western singer that came from poverty to fame.",1980-03-07,Coal Miner's Daughter,7.256
"[18, 36]",en,The Elephant Man,"A Victorian surgeon rescues a heavily disfigured man being mistreated by his ""owner"" as a side-show freak. Behind his monstrous façade, there is revealed a person of great intelligence and sensitivity. Based on the true story of Joseph Merrick (called John Merrick in the film), a severely deformed man in 19th century London.",1980-10-09,The Elephant Man,8.048
[18],en,Ordinary People,"Beth, Calvin, and their son Conrad are living in the aftermath of the death of the other son. Conrad is overcome by grief and misplaced guilt to the extent of a suicide attempt. He is in therapy. Beth had always preferred his brother and is having difficulty being supportive to Conrad. Calvin is trapped between the two trying to hold the family together.",1980-09-19,Ordinary People,7.441
[18],en,Raging Bull,"The life of boxer Jake LaMotta, whose violence and temper that led him to the top in the ring destroyed his life outside of it.",1980-11-14,Raging Bull,7.944
"[18, 10749]",en,Tess,"A strong-willed peasant girl is sent by her father to the estate of some local aristocrats to capitalize on a rumor that their families are from the same line, but is left traumatised from her experiences.",1979-10-06,Tess,7.016
"[80, 18, 10749]",en,Atlantic City,"In a corrupt city, a small-time gangster and the estranged wife of a pot dealer find themselves thrown together in an escapade of love, money, drugs and danger.",1980-09-03,Atlantic City,6.838
"[18, 36]",en,Chariots of Fire,"In the class-obsessed and religiously divided UK of the early 1920s, two determined young runners train for the 1924 Paris Olympics. Eric Liddell, a devout Christian born to Scottish missionaries in China, sees running as part of his worship of God's glory and refuses to train or compete on the Sabbath. Harold Abrahams overcomes anti-Semitism and class bias, but neglects his beloved sweetheart in his single-minded quest.",1981-05-15,Chariots of Fire,6.794
"[18, 10749]",en,On Golden Pond,"For Norman and Ethel Thayer, this summer on golden pond is filled with conflict and resolution. When their daughter Chelsea arrives, the family is forced to renew the bonds of love and overcome the generational friction that has existed for years.",1981-12-01,On Golden Pond,7.272
"[12, 28]",en,Raiders of the Lost Ark,"When Dr. Indiana Jones – the tweed-suited professor who just happens to be a celebrated archaeologist – is hired by the government to locate the legendary Ark of the Covenant, he finds himself up against the entire Nazi regime.",1981-06-12,Raiders of the Lost Ark,7.927
"[18, 36, 10749]",en,Reds,"An account of the revolutionary years of the legendary American journalist John Reed, who shared his adventurous professional life with his radical commitment to the socialist revolution in Russia, his dream of spreading its principles among the members of the American working class, and his troubled romantic relationship with the writer Louise Bryant.",1981-12-25,Reds,6.902
"[878, 12, 10751, 14]",en,E.T. the Extra-Terrestrial,"An alien is left behind on Earth and saved by the 10-year-old Elliot who decides to keep him hidden in his home. While a task force hunts for the extra-terrestrial, Elliot, his brother, and his little sister Gertie form an emotional bond with their new friend, and try to help him find his way home.",1982-06-11,E.T. the Extra-Terrestrial,7.515
"[18, 36]",en,Gandhi,"In the early years of the 20th century, Mohandas K. Gandhi, a British-trained lawyer, forsakes all worldly possessions to take up the cause of Indian independence. Faced with armed resistance from the British government, Gandhi adopts a policy of 'passive resistance', endeavouring to win freedom for his people without resorting to bloodshed.",1982-11-30,Gandhi,7.545
"[18, 9648, 53]",en,Missing,Based on the real-life experiences of Ed Horman. A conservative American businessman travels to Chile to investigate the sudden disappearance of his son after a military takeover. Accompanied by his son's wife he uncovers a trail of cover-ups that implicate the US State department which supports the dictatorship.,1982-02-12,Missing,7.25
"[35, 10749]",en,Tootsie,"When struggling, out of work actor Michael Dorsey secretly adopts a female alter ego - Dorothy Michaels - in order to land a part in a daytime drama, he unwittingly becomes a feminist icon and ends up in a romantic pickle.",1982-12-17,Tootsie,7.214
[18],en,The Verdict,"Frank Galvin is a down-on-his-luck lawyer and reduced to drinking and ambulance chasing, when a former associate reminds him of his obligations in a medical malpractice suit by serving it to Galvin on a silver platter—all parties are willing to settle out of court. Blundering his way through the preliminaries, Galvin suddenly realizes that the case should actually go to court—to punish the guilty, to get a decent settlement for his clients... and to restore his standing as a lawyer.",1982-12-08,The Verdict,7.47
"[35, 18]",en,The Big Chill,Seven old college friends gather for a weekend reunion after the funeral of one of their own.,1983-09-30,The Big Chill,6.874
[18],en,The Dresser,"In a touring Shakespearean theater group, a backstage hand - the dresser, is devoted to the brilliant but tyrannical head of the company. He struggles to support the deteriorating star as the company struggles to carry on during the London blitz. The pathos of his backstage efforts rival the pathos in the story of Lear and the Fool that is being presented on-stage, as the situation comes to a crisis.",1983-12-06,The Dresser,6.7
"[18, 36, 12]",en,The Right Stuff,"A chronicle of the original Mercury astronauts in the formation of America's space program: Alan Shepherd, the first American in space; Gus Grissom, the benighted astronaut for whom nothing works out as planned; John Glenn, the straight-arrow 'boy scout' of the bunch who was the first American to orbit the earth; and the remaining pilots: Deke Slayton, Scott Carpenter, Wally Schirra, and Gordon Cooper.",1983-10-20,The Right Stuff,7.433
"[18, 10402, 10749]",en,Tender Mercies,Alchoholic former country singer Mac Sledge makes friends with a young widow and her son. The friendship enables him to find inspiration to resume his career.,1983-04-02,Tender Mercies,6.58
"[18, 35]",en,Terms of Endearment,"Aurora, a finicky woman, is in search of true love while her daughter faces marital issues. Together, they help each other deal with problems and find reasons to live a joyful life.",1983-11-20,Terms of Endearment,7.103
"[36, 10402, 18]",en,Amadeus,"Wolfgang Amadeus Mozart is a remarkably talented young Viennese composer who unwittingly finds a fierce rival in the disciplined and determined Antonio Salieri. Resenting Mozart for both his hedonistic lifestyle and his undeniable talent, the highly religious Salieri is gradually consumed by his jealousy and becomes obsessed with Mozart's downfall, leading to a devious scheme that has dire consequences for both men.",1984-09-19,Amadeus,8.036
"[18, 36, 10752]",en,The Killing Fields,"New York Times reporter Sydney Schanberg is on assignment covering the Cambodian Civil War, with the help of local interpreter Dith Pran and American photojournalist Al Rockoff. When the U.S. Army pulls out amid escalating violence, Schanberg makes exit arrangements for Pran and his family. Pran, however, tells Schanberg he intends to stay in Cambodia to help cover the unfolding story — a decision he may regret as the Khmer Rouge rebels move in.",1984-11-23,The Killing Fields,7.504
"[18, 12, 36]",en,A Passage to India,"Set during the period of growing influence of the Indian independence movement in the British Raj, the story begins with the arrival in India of a British woman, Miss Adela Quested, who is joining her fiancé, a city magistrate named Ronny Heaslop. She and Ronny's mother, Mrs. Moore, befriend an Indian doctor, Aziz H. Ahmed.",1984-12-14,A Passage to India,6.801
[18],en,Places in the Heart,"In 1930s Texas, a widow and her family fight to save their home by harvesting cotton.",1984-09-11,Places in the Heart,7.152
"[18, 9648, 10752, 80]",en,A Soldier's Story,"In a rural town in Louisiana, a black Master Sergeant is found shot to death just outside the local Army Base. Military lawyer, Captain Davenport—also a black man—is sent from Washington to conduct an investigation. Facing an uncooperative chain of command and fearful black troops, Davenport must battle with deceit and prejudice in order to find out exactly who really did kill the Master Sergeant.",1984-09-14,A Soldier's Story,6.729
"[18, 36]",en,The Color Purple,"An epic tale spanning forty years in the life of Celie, an African-American woman living in the South who survives incredible abuse and bigotry. After Celie's abusive father marries her off to the equally debasing 'Mister' Albert Johnson, things go from bad to worse, leaving Celie to find companionship anywhere she can. She perseveres, holding on to her dream of one day being reunited with her sister in Africa.",1985-12-18,The Color Purple,7.747
[18],en,Kiss of the Spider Woman,"The story of two radically different men thrown together in a Latin American prison cell. One is Valentin, a journalist being tortured for his political beliefs. The other is Molina, a gay window-dresser who fills their lonely nights by spinning romantic fantasies drawn from memories of old movies.",1985-07-26,Kiss of the Spider Woman,7.038
"[36, 10749, 18]",en,Out of Africa,"Out of Africa tells the story of the life of Danish author Karen Blixen, who at the beginning of the 20th century moved to Africa to build a new life for herself. The film is based on the autobiographical novel by Karen Blixen from 1937.",1985-12-20,Out of Africa,7.167
"[10749, 35, 80]",en,Prizzi's Honor,"Charley Partanna is a hitman who works for the Prizzis, one of the richest crime families in the US. When he sees Irene Walker, it's love at first sight. But he soon finds that she, too, is a killer for hire. Charley can overlook his suspicions, but he can't turn off his heart. And the couple must remember that even if they love each other, the Prizzis love only money.",1985-06-14,Prizzi's Honor,6.346
"[80, 18, 10749, 53]",en,Witness,"A sheltered Amish child is the sole witness of a brutal murder in a restroom at a Philadelphia train station, and he must be protected.  The assignment falls to a taciturn detective who goes undercover in a Pennsylvania Dutch community. On the farm, he slowly assimilates despite his urban grit and forges a romantic bond with the child's beautiful mother.",1985-02-08,Witness,7.082
"[18, 10749]",en,Children of a Lesser God,"Starting his new job as an instructor at a New England school for the deaf, James Leeds meets Sarah Norman, a young deaf woman who works at the school as a member of the custodial staff. In spite of Sarah's withdrawn emotional state, a romance slowly develops between the pair.",1986-09-13,Children of a Lesser God,6.93
"[35, 18]",en,Hannah and Her Sisters,"Between two Thanksgivings, Hannah's husband falls in love with her sister Lee, while her hypochondriac ex-husband rekindles his relationship with her sister Holly.",1986-02-07,Hannah and Her Sisters,7.503
"[12, 18, 28, 36]",en,The Mission,"When a Spanish Jesuit goes into the South American wilderness to build a mission in the hope of converting the Indians of the region, a slave hunter is converted and joins his mission. When Spain sells the colony to Portugal, they are forced to defend all they have built against the Portuguese aggressors.",1986-09-24,The Mission,7.393
"[18, 10752, 28]",en,Platoon,"As a young and naive recruit in Vietnam, Chris Taylor faces a moral crisis when confronted with the horrors of war and the duality of man.",1986-12-19,Platoon,7.746
"[18, 10749]",en,A Room with a View,"When Lucy Honeychurch and chaperon Charlotte Bartlett find themselves in Florence with rooms without views, fellow guests Mr Emerson and son George step in to remedy the situation. Meeting the Emersons could change Lucy's life forever but, once back in England, how will her experiences in Tuscany affect her marriage plans?",1986-03-07,A Room with a View,7.004
"[35, 10749]",en,Broadcast News,"Basket-case network news producer Jane Craig falls for new reporter Tom Grunnick, a pretty boy who represents the trend towards entertainment news she despises. Aaron Altman, a talented but plain correspondent, carries an unrequited torch for Jane. Sparks fly between the three as the network prepares for big changes, and both the news and Jane must decide between style and substance.",1987-12-16,Broadcast News,6.712
"[18, 53]",en,Fatal Attraction,"For Dan Gallagher, life is good. He is on the rise at his New York law firm, is happily married to his wife, Beth, and has a loving daughter. But, after a casual fling with a sultry book editor named Alex, everything changes. Jilted by Dan, Alex becomes unstable, her behavior escalating from aggressive pursuit to obsessive stalking. Dan realizes that his main problem is not hiding his affair, but rather saving himself and his family.",1987-09-18,Fatal Attraction,6.849
"[18, 10752, 10751]",en,Hope and Glory,A middle-aged man recalls his childhood growing up in and around London during World War II.,1987-09-03,Hope and Glory,6.778
"[18, 36]",en,The Last Emperor,"A dramatic history of Pu Yi, the last of the Emperors of China, from his lofty birth and brief reign in the Forbidden City, the object of worship by half a billion people; through his abdication, his decline and dissolute lifestyle; his exploitation by the invading Japanese, and finally to his obscure existence as just another peasant worker in the People's Republic.",1987-10-04,The Last Emperor,7.629
"[35, 18, 10749]",en,Moonstruck,"37-year-old Italian-American widow Loretta Castorini believes she is unlucky in love, and so accepts a marriage proposal from her boyfriend Johnny, even though she doesn't love him. When she meets his estranged younger brother Ronny, an emotional and passionate man, she finds herself drawn to him. She tries to resist, but Ronny, who blames his brother for the loss of his hand, has no scruples about aggressively pursuing her while Johnny is out of the country. As Loretta falls for Ronny, she learns that she's not the only one in her family with a secret romance.",1987-12-16,Moonstruck,6.863
"[35, 18, 10749]",en,The Accidental Tourist,"After the death of his son, travel writer Macon Leary seems to be sleep walking through life. Macon's wife is having similar problems. They separate, and Macon meets a strange, outgoing woman who brings him 'back down to earth', but his wife soon thinks their marriage is still worth another try.",1988-12-23,The Accidental Tourist,6.207
"[18, 10749]",en,Dangerous Liaisons,"In 18th century France, Marquise de Merteuil asks her ex-lover Vicomte de Valmont to seduce the future wife of another ex-lover of hers in return for one last night with her. Yet things don’t go as planned.",1988-12-21,Dangerous Liaisons,7.2
"[18, 80]",en,Mississippi Burning,"Two FBI agents investigating the murder of civil rights workers during the 60s seek to breach the conspiracy of silence in a small Southern town where segregation divides black and white. The younger agent trained in FBI school runs up against the small town ways of his partner, a former sheriff.",1988-12-08,Mississippi Burning,7.665
[18],en,Rain Man,"When car dealer Charlie Babbitt learns that his estranged father has died, he returns home to Cincinnati, where he discovers that he has a savant older brother named Raymond and that his father's $3 million fortune is being left to the mental institution in which Raymond lives. Motivated by his father's money, Charlie checks Raymond out of the facility in order to return with him to Los Angeles. The brothers' cross-country trip ends up changing both their lives.",1988-12-12,Rain Man,7.76
"[35, 10749, 18]",en,Working Girl,"Tess McGill is an ambitious secretary with a unique approach for climbing the ladder to success. When her classy, but villainous boss breaks a leg skiing, Tess takes over her office, her apartment and even her wardrobe. She creates a deal with a handsome investment banker that will either take her to the top, or finish her off for good.",1988-12-20,Working Girl,6.6
"[18, 10752]",en,Born on the Fourth of July,"Paralyzed in the Vietnam war, Ron Kovic becomes an anti-war and pro-human rights political activist after feeling betrayed by the country he fought for.",1989-12-20,Born on the Fourth of July,7.003
[18],en,Dead Poets Society,"At an elite, old-fashioned boarding school in New England, a passionate English teacher inspires his students to rebel against convention and seize the potential of every day, courting the disdain of the stern headmaster.",1989-06-02,Dead Poets Society,8.313
[18],en,Driving Miss Daisy,"The story of an old Jewish widow named Daisy Werthan and her relationship with her black chauffeur, Hoke. From an initial mere work relationship grew in 25 years a strong friendship between the two very different characters in a time when those types of relationships where shunned.",1989-12-13,Driving Miss Daisy,7.228
"[18, 14]",en,Field of Dreams,"Ray Kinsella is an Iowa farmer who hears a mysterious voice telling him to turn his cornfield into a baseball diamond. He does, but the voice's directions don't stop -- even after the spirits of deceased ballplayers turn up to play.",1989-04-21,Field of Dreams,7.106
[18],en,My Left Foot: The Story of Christy Brown,"No one expects much from Christy Brown, a boy with cerebral palsy born into a working-class Irish family. Though Christy is a spastic quadriplegic and essentially paralyzed, a miraculous event occurs when, at the age of 5, he demonstrates control of his left foot by using chalk to scrawl a word on the floor. With the help of his steely mother — and no shortage of grit and determination — Christy overcomes his infirmity to become a painter, poet and author.",1989-04-07,My Left Foot: The Story of Christy Brown,7.521
[18],en,Awakenings,"Dr. Malcolm Sayer, a shy research physician, uses an experimental drug to ""awaken"" the catatonic victims of a rare disease. Leonard is the first patient to receive the controversial treatment. His awakening, filled with awe and enthusiasm, proves a rebirth for Sayer too, as the exuberant patient reveals life's simple but unutterably sweet pleasures to the introverted doctor.",1990-12-04,Awakenings,7.756
"[12, 18, 37]",en,Dances with Wolves,"Wounded Civil War soldier, John Dunbar tries to commit suicide—and becomes a hero instead. As a reward, he's assigned to his dream post, a remote junction on the Western frontier, and soon makes unlikely friends with the local Sioux tribe.",1990-03-30,Dances with Wolves,7.847
"[14, 18, 53, 9648, 10749]",en,Ghost,"Sam Wheat is a banker, Molly Jensen is an artist, and the two are madly in love. However, when Sam is murdered by his friend and corrupt business partner Carl Bruner over a shady business deal, he is left to roam the earth as a powerless spirit. When he learns of Carl's betrayal, Sam must seek the help of psychic Oda Mae Brown to set things right and protect Molly from Carl and his goons.",1990-07-13,Ghost,7.209
"[80, 18, 53]",en,The Godfather Part III,"In the midst of trying to legitimize his business dealings in 1979 New York and Italy, aging mafia don, Michael Corleone seeks forgiveness for his sins while taking a young protege under his wing.",1990-12-25,The Godfather Part III,7.425
"[18, 80]",en,GoodFellas,"The true story of Henry Hill, a half-Irish, half-Sicilian Brooklyn kid who is adopted by neighbourhood gangsters at an early age and climbs the ranks of a Mafia family under the guidance of Jimmy Conway.",1990-09-12,GoodFellas,8.466
"[10749, 10751, 16, 14]",en,Beauty and the Beast,"Follow the adventures of Belle, a bright young woman who finds herself in the castle of a prince who's been turned into a mysterious beast. With the help of the castle's enchanted staff, Belle soon learns the most important lesson of all -- that true beauty comes from within.",1991-10-22,Beauty and the Beast,7.7
