genre_ids,original_language,original_title,overview,release_date,title,vote_average
"[80, 18, 9648]",en,Bugsy,"New York gangster Ben 'Bugsy' Siegel takes a brief business trip to Los Angeles. A sharp-dressing womanizer with a foul temper, Siegel doesn't hesitate to kill or maim anyone crossing him. In L.A. the life, the movies, and most of all strong-willed Virginia Hill detain him while his family wait back home. Then a trip to a run-down gambling joint at a spot in the desert known as Las Vegas gives him his big idea.",1991-12-10,Bugsy,6.374
"[18, 53, 36]",en,JFK,Follows the investigation into the assassination of President John F. Kennedy led by New Orleans district attorney Jim Garrison.,1991-12-20,JFK,7.601
"[18, 10749]",en,The Prince of Tides,A troubled man talks to his suicidal sister's psychiatrist about their family history and falls in love with her in the process.,1991-12-25,The Prince of Tides,6.604
"[80, 18, 53]",en,The Silence of the Lambs,"Clarice Starling is a top student at the FBI's training academy.  Jack Crawford wants Clarice to interview Dr. Hannibal Lecter, a brilliant psychiatrist who is also a violent psychopath, serving life behind bars for various acts of murder and cannibalism.  Crawford believes that Lecter may have insight into a case and that Starling, as an attractive young woman, may be just the bait to draw him out.",1991-02-14,The Silence of the Lambs,8.345
"[80, 18, 53]",en,The Crying Game,"Irish Republican Army member Fergus forms an unexpected bond with Jody, a kidnapped British soldier in his custody, despite the warnings of fellow IRA members Jude and Maguire. Jody makes Fergus promise he'll visit his girlfriend, Dil, in London, and when Fergus flees to the city, he seeks her out. Hounded by his former IRA colleagues, he finds himself increasingly drawn to the enigmatic, and surprising, Dil.",1992-09-02,The Crying Game,6.853
[18],en,A Few Good Men,"When cocky military lawyer Lt. Daniel Kaffee and his co-counsel, Lt. Cmdr. JoAnne Galloway, are assigned to a murder case, they uncover a hazing ritual that could implicate high-ranking officials such as shady Col. Nathan Jessep.",1992-12-11,A Few Good Men,7.528
"[18, 10749]",en,Howards End,"A saga of class relations and changing times in an Edwardian England on the brink of modernity, the film centers on liberal Margaret Schlegel, who, along with her sister Helen, becomes involved with two couples: wealthy, conservative industrialist Henry Wilcox and his wife Ruth, and the downwardly mobile working-class Leonard Bast and his mistress Jackie.",1992-03-13,Howards End,7.053
"[18, 10749]",en,Scent of a Woman,"Charlie Simms is a student at a private preparatory school who comes from a poor family. To earn the money for his flight home to Gresham, Oregon for Christmas, Charlie takes a job over Thanksgiving looking after retired U.S. Army officer Lieutenant Colonel Frank Slade, a cantankerous middle-aged man who lives with his niece and her family.",1992-12-23,Scent of a Woman,7.8
[37],en,Unforgiven,"William Munny is a retired, once-ruthless killer turned gentle widower and hog farmer. To help support his two motherless children, he accepts one last bounty-hunter mission to find the men who brutalized a prostitute. Joined by his former partner and a cocky greenhorn, he takes on a corrupt sheriff.",1992-08-07,Unforgiven,7.913
"[28, 53, 18]",en,The Fugitive,"Wrongfully convicted of murdering his wife and sentenced to death, Richard Kimble escapes from the law in an attempt to find the real killer and clear his name.",1993-08-06,The Fugitive,7.467
[18],en,In the Name of the Father,"A small time thief from Belfast, Gerry Conlon, is falsely implicated in the IRA bombing of a pub that kills several people while he is in London. He and his four friends are coerced by British police into confessing their guilt. Gerry's father and other relatives in London are also implicated in the crime. He spends fifteen years in prison with his father trying to prove his innocence.",1993-12-12,In the Name of the Father,7.902
"[18, 10749]",en,The Piano,"A mute Scottish woman arrives in colonial New Zealand for an arranged marriage. Her husband refuses to move her beloved piano, giving it to neighbor George Baines, who agrees to return the piano in exchange for lessons. As desire swirls around the duo, the wilderness consumes the European enclave.",1993-05-19,The Piano,7.375
"[18, 10749]",en,The Remains of the Day,A rule bound head butler's world of manners and decorum in the household he maintains is tested by the arrival of a housekeeper who falls in love with him in post-WWI Britain. The possibility of romance and his master's cultivation of ties with the Nazi cause challenge his carefully maintained veneer of servitude.,1993-11-05,The Remains of the Day,7.362
"[18, 36, 10752]",en,Schindler's List,The true story of how businessman Oskar Schindler saved over a thousand Jewish lives from the Nazis while they worked as slaves in his factory during World War II.,1993-12-15,Schindler's List,8.572
"[35, 18, 10749]",en,Forrest Gump,"A man with a low IQ has accomplished great things in his life and been present during significant historic events—in each case, far exceeding what anyone imagined he could do. But despite all he has achieved, his one true love eludes him.",1994-06-23,Forrest Gump,8.477
"[35, 18, 10749]",en,Four Weddings and a Funeral,"Over the course of five social occasions, a committed bachelor must consider the notion that he may have discovered love.",1994-03-09,Four Weddings and a Funeral,6.761
"[53, 80]",en,Pulp Fiction,"A burger-loving hit man, his philosophical partner, a drug-addled gangster's moll and a washed-up boxer converge in this sprawling, comedic crime caper. Their adventures unfurl in three stories that ingeniously trip back and forth in time.",1994-09-10,Pulp Fiction,8.489
"[36, 18, 9648]",en,Quiz Show,"Herbert Stempel's transformation into an unexpected television personality unfolds as he secures victory on the cherished American game show, 'Twenty-One.' However, when the show introduces the highly skilled contestant Charles Van Doren to replace Stempel, it compels Stempel to let out his frustrations and call out the show as rigged. Lawyer Richard Goodwin steps in and attempts to uncover the orchestrated deception behind the scenes.",1994-08-25,Quiz Show,7.266
"[18, 80]",en,The Shawshank Redemption,"Framed in the 1940s for the double murder of his wife and her lover, upstanding banker Andy Dufresne begins a new life at the Shawshank prison, where he puts his accounting skills to work for an amoral warden. During his long stretch in prison, Dufresne comes to be admired by the other inmates -- including an older prisoner named Red -- for his integrity and unquenchable sense of hope.",1994-09-23,The Shawshank Redemption,8.71
"[18, 36]",en,Apollo 13,"The true story of technical troubles that scuttle the Apollo 13 lunar mission in 1970, risking the lives of astronaut Jim Lovell and his crew, with the failed journey turning into a thrilling saga of heroism. Drifting more than 200,000 miles from Earth, the astronauts work furiously with the ground crew to avert tragedy.",1995-06-30,Apollo 13,7.449
"[14, 18, 35, 10751]",en,Babe,"Babe is a little pig who doesn't quite know his place in the world. With a bunch of odd friends, like Ferdinand the duck who thinks he is a rooster and Fly the dog he calls mum, Babe realises that he has the makings to become the greatest sheep pig of all time, and Farmer Hogget knows it. With the help of the sheep dogs, Babe learns that a pig can be anything that he wants to be.",1995-07-18,Babe,6.191
"[28, 18, 36, 10752]",en,Braveheart,"Enraged at the slaughter of Murron, his new bride and childhood love, Scottish warrior William Wallace slays a platoon of the local English lord's soldiers. This leads the village to revolt and, eventually, the entire country to rise up against English rule.",1995-05-24,Braveheart,7.936
"[35, 18, 10749]",it,Il postino,Simple Italian postman learns to love poetry while delivering mail to a famous poet; he uses this to woo local beauty Beatrice.,1994-04-07,The Postman,7.935
"[18, 10749]",en,Sense and Sensibility,"The Dashwood sisters, sensible Elinor and passionate Marianne, whose chances at marriage seem doomed by their family's sudden loss of fortune.  When Henry Dashwood dies unexpectedly, his estate must pass on by law to his son from his first marriage, John and wife Fanny. But these circumstances leave Mr. Dashwood's current wife, and daughters Elinor, Marianne and Margaret, without a home and with barely enough money to live on. As Elinor and Marianne struggle to find romantic fulfillment in a society obsessed with financial and social status, they must learn to mix sense with sensibility in their dealings with both money and men.",1995-12-13,Sense and Sensibility,7.437
"[18, 10749, 10752]",en,The English Patient,"In the 1930s, Count Almásy is a Hungarian map maker employed by the Royal Geographical Society to chart the vast expanses of the Sahara Desert along with several other prominent explorers. As World War II unfolds, Almásy enters into a world of love, betrayal, and politics.",1996-11-14,The English Patient,7.174
"[80, 18, 53]",en,Fargo,"Jerry, a small-town Minnesota car salesman is bursting at the seams with debt... but he's got a plan. He's going to hire two thugs to kidnap his wife in a scheme to collect a hefty ransom from his wealthy father-in-law. It's going to be a snap and nobody's going to get hurt... until people start dying. Enter Police Chief Marge, a coffee-drinking, parka-wearing - and extremely pregnant - investigator who'll stop at nothing to get her man. And if you think her small-time investigative skills will give the crooks a run for their ransom... you betcha!",1996-03-08,Fargo,7.865
"[35, 18, 10749]",en,Jerry Maguire,"Jerry Maguire used to be a typical sports agent: willing to do just about anything he could to get the biggest possible contracts for his clients, plus a nice commission for himself. Then, one day, he suddenly has second thoughts about what he's really doing. When he voices these doubts, he ends up losing his job and all of his clients, save Rod Tidwell, an egomaniacal football player.",1996-12-13,Jerry Maguire,6.951
[18],en,Secrets & Lies,"After her adoptive mother dies, Hortense, a successful black optometrist, seeks out her birth mother. She's shocked when her research leads her to a working class white woman, Cynthia. At first Cynthia denies the claim, but she eventually admits to birthing Hortense as a teenager, and the two begin to bond. However, when Cynthia invites Hortense to a family barbecue, Cynthia's already tense relationship with her family becomes even more complicated.",1996-05-24,Secrets & Lies,7.558
[18],en,Shine,"Pianist David Helfgott, driven by his father and teachers, has a breakdown. Years later he returns to the piano, to popular if not critical acclaim.",1996-08-15,Shine,7.363
"[18, 35, 10749]",en,As Good as It Gets,"Melvin Udall, a cranky, bigoted, obsessive-compulsive writer of romantic fiction, is rude to everyone he meets, including his gay neighbor, Simon. After Simon is hospitalized, Melvin finds his life turned upside down when he has to look after Simon's dog. In addition, Carol, the only waitress at the local diner who will tolerate him, must leave work to care for her sick son, making it impossible for Melvin to eat breakfast.",1997-12-19,As Good as It Gets,7.4
[35],en,The Full Monty,"Sheffield, England. Gaz, a jobless steelworker in need of quick cash persuades his mates to bare it all in a one-night-only strip show.",1997-08-13,The Full Monty,6.986
[18],en,Good Will Hunting,"Will Hunting has a genius-level IQ but chooses to work as a janitor at MIT. When he solves a difficult graduate-level math problem, his talents are discovered by Professor Gerald Lambeau, who decides to help the misguided youth reach his potential. When Will is arrested for attacking a police officer, Professor Lambeau makes a deal to get leniency for him if he will get treatment from therapist Sean Maguire.",1997-12-05,Good Will Hunting,8.153
"[80, 9648, 53]",en,L.A. Confidential,Three detectives in the corrupt and brutal L.A. police force of the 1950s use differing methods to uncover a conspiracy behind the shotgun slayings of the patrons at an all-night diner.,1997-09-19,L.A. Confidential,7.788
"[18, 10749]",en,Titanic,"101-year-old Rose DeWitt Bukater tells the story of her life aboard the Titanic, 84 years later. A young Rose boards the ship with her mother and fiancé. Meanwhile, Jack Dawson and Fabrizio De Rossi win third-class tickets aboard the ship. Rose tells the whole story from Titanic's departure through to its death—on its first and last voyage—on April 15, 1912.",1997-11-18,Titanic,7.902
"[18, 36]",en,Elizabeth,"The story of the ascension to the throne and the early reign of Queen Elizabeth the First, the endless attempts by her council to marry her off, the Catholic hatred of her and her romance with Lord Robert Dudley.",1998-09-13,Elizabeth,7.174
"[35, 18]",it,La vita è bella,A touching story of an Italian book seller of Jewish ancestry who lives in his own little fairy tale. His creative and happy life would come to an abrupt halt when his entire family is deported to a concentration camp during World War II. While locked up he tries to convince his son that the whole thing is just a game.,1997-12-20,Life Is Beautiful,8.456
"[18, 36, 10752]",en,Saving Private Ryan,"As U.S. troops storm the beaches of Normandy, three brothers lie dead on the battlefield, with a fourth trapped behind enemy lines. Ranger captain John Miller and seven men are tasked with penetrating German-held territory and bringing the boy home.",1998-07-24,Saving Private Ryan,8.212
"[10749, 36, 35]",en,Shakespeare in Love,"Young Shakespeare is forced to stage his latest comedy, ""Romeo and Ethel, the Pirate's Daughter,"" before it's even written. When a lovely noblewoman auditions for a role, they fall into forbidden love -- and his play finds a new life (and title). As their relationship progresses, Shakespeare's comedy soon transforms into tragedy.",1998-12-11,Shakespeare in Love,6.9
"[18, 36, 10752]",en,The Thin Red Line,"The story of a group of men, an Army Rifle company called C-for-Charlie, who change, suffer, and ultimately make essential discoveries about themselves during the fierce World War II battle of Guadalcanal. It follows their journey, from the surprise of an unopposed landing, through the bloody and exhausting battles that follow, to the ultimate departure of those who survived.",1998-12-23,The Thin Red Line,7.444
[18],en,American Beauty,"Lester Burnham, a depressed suburban father in a mid-life crisis, decides to turn his hectic life around after developing an infatuation with his daughter's attractive friend.",1999-09-15,American Beauty,8.019
[18],en,The Cider House Rules,"Homer is an orphan who was never adopted, becoming the favorite of orphanage director Dr. Larch. Dr. Larch imparts his full medical knowledge on Homer, who becomes a skilled, albeit unlicensed, physician. But Homer yearns for a self-chosen life outside the orphanage. What will Homer learn about life and love in the cider house? What of the destiny that Dr. Larch has planned for him?",1999-12-17,The Cider House Rules,7.02
"[14, 18, 80]",en,The Green Mile,"A supernatural tale set on death row in a Southern prison, where gentle giant John Coffey possesses the mysterious power to heal people's ailments. When the cell block's head guard, Paul Edgecomb, recognizes Coffey's miraculous gift, he tries desperately to help stave off the condemned man's execution.",1999-12-10,The Green Mile,8.51
"[18, 53]",en,The Insider,A research chemist comes under personal and professional attack when he decides to appear in a 60 Minutes exposé on Big Tobacco.,1999-10-28,The Insider,7.463
"[9648, 53, 18]",en,The Sixth Sense,"Following an unexpected tragedy, child psychologist Malcolm Crowe meets a nine year old boy named Cole Sear, who is hiding a dark secret.",1999-08-06,The Sixth Sense,7.947
"[35, 18, 10749]",en,Chocolat,"A mother and daughter move to a small French town where they open a chocolate shop. The town, religious and morally strict, is against them, as they represent free-thinking and indulgence. When a group of gypsies arrive by riverboat, the Mayor's prejudices lead to a crisis.",2000-12-22,Chocolat,6.966
"[12, 18, 28, 10749]",zh,卧虎藏龍,"Two warriors in pursuit of a stolen sword and a notorious fugitive are led to an impetuous, physically-skilled, teenage nobleman's daughter, who is at a crossroads in her life.",2000-07-06,"Crouching Tiger, Hidden Dragon",7.415
[18],en,Erin Brockovich,"A twice-divorced mother of three who sees an injustice, takes on the bad guy and wins -- with a little help from her push-up bra. Erin goes to work for an attorney and comes across medical records describing illnesses clustered in one nearby town. She starts investigating and soon exposes a monumental cover-up.",2000-03-17,Erin Brockovich,7.427
"[28, 18, 12]",en,Gladiator,"In the year 180, the death of emperor Marcus Aurelius throws the Roman Empire into chaos.  Maximus is one of the Roman army's most capable and trusted generals and a key advisor to the emperor.  As Marcus' devious son Commodus ascends to the throne, Maximus is set to be executed.  He escapes, but is captured by slave traders.  Renamed Spaniard and forced to become a gladiator, Maximus must battle to the death with other men for the amusement of paying audiences.",2000-05-04,Gladiator,8.213
"[53, 18, 80]",en,Traffic,"An exploration of the United States of America's war on drugs from multiple perspectives. For the new head of the Office of National Drug Control Policy, the war becomes personal when he discovers his well-educated daughter is abusing cocaine within their comfortable suburban home. In Mexico, a flawed, but noble policeman agrees to testify against a powerful general in league with a cartel, and in San Diego, a drug kingpin's sheltered trophy wife must learn her husband's ruthless business after he is arrested, endangering her luxurious lifestyle.",2000-12-27,Traffic,7.0
"[18, 10749]",en,A Beautiful Mind,"In a decades-spanning biopic, brilliant mathematician John Forbes Nash Jr. makes history in his field as schizophrenia sets in.",2001-12-14,A Beautiful Mind,7.855
"[18, 9648, 53]",en,Gosford Park,"In 1930s England, a group of pretentious rich and famous gather together for a weekend of relaxation at a hunting resort. But when a murder occurs, each one of these interesting characters becomes a suspect.",2001-11-07,Gosford Park,6.843
"[18, 53]",en,In the Bedroom,"Summertime on the coast of Maine, ""In the Bedroom"" centers on the inner dynamics of a family in transition. Matt Fowler is a doctor practicing in his native Maine and is married to New York born Ruth Fowler, a music teacher. His son is involved in a love affair with a local single mother. As the beauty of Maine's brief and fleeting summer comes to an end, these characters find themselves in the midst of unimaginable tragedy.",2001-11-23,In the Bedroom,6.919
"[12, 14, 28]",en,The Lord of the Rings: The Fellowship of the Ring,"Young hobbit Frodo Baggins, after inheriting a mysterious ring from his uncle Bilbo, must leave his home in order to keep it from falling into the hands of its evil creator. Along the way, a fellowship is formed to protect the ringbearer and make sure that the ring arrives at its final destination: Mt. Doom, the only place where it can be destroyed.",2001-12-18,The Lord of the Rings: The Fellowship of the Ring,8.407
"[18, 10749, 10402]",en,Moulin Rouge!,"A celebration of love and creative inspiration takes place in the infamous, gaudy and glamorous Parisian nightclub, at the cusp of the 20th century. A young poet, who is plunged into the heady world of Moulin Rouge, begins a passionate affair with the club's most notorious and beautiful star.",2001-05-24,Moulin Rouge!,7.574
"[35, 80, 18]",en,Chicago,Murderesses Velma Kelly and Roxie Hart find themselves on death row together and fight for the fame that will keep them from the gallows in 1920s Chicago.,2002-12-10,Chicago,7.1
"[18, 36, 80]",en,Gangs of New York,"In 1863, Amsterdam Vallon returns to the Five Points of America to seek vengeance against the psychotic gangland kingpin, Bill the Butcher, who murdered his father years earlier. With an eager pickpocket by his side and a whole new army, Vallon fights his way to seek vengeance on the Butcher and restore peace in the area.",2002-12-14,Gangs of New York,7.319
[18],en,The Hours,"""The Hours"" is the story of three women searching for more potent, meaningful lives. Each is alive at a different time and place, all are linked by their yearnings and their fears. Their stories intertwine, and finally come together in a surprising, transcendent moment of shared recognition.",2002-12-27,The Hours,7.289
"[12, 14, 28]",en,The Lord of the Rings: The Two Towers,"Frodo and Sam are trekking to Mordor to destroy the One Ring of Power while Gimli, Legolas and Aragorn search for the orc-captured Merry and Pippin. All along, nefarious wizard Saruman awaits the Fellowship members at the Orthanc Tower in Isengard.",2002-12-18,The Lord of the Rings: The Two Towers,8.389
"[18, 10752]",en,The Pianist,"The true story of pianist Władysław Szpilman's experiences in Warsaw during the Nazi occupation. When the Jews of the city find themselves forced into a ghetto, Szpilman finds work playing in a café; and when his family is deported in 1942, he stays behind, works for a while as a laborer, and eventually goes into hiding in the ruins of the war-torn city.",2002-09-17,The Pianist,8.384
"[12, 14, 28]",en,The Lord of the Rings: The Return of the King,"Aragorn is revealed as the heir to the ancient kings as he, Gandalf and the other members of the broken fellowship struggle to save Gondor from Sauron's forces. Meanwhile, Frodo and Sam take the ring closer to the heart of Mordor, the dark lord's realm.",2003-12-01,The Lord of the Rings: The Return of the King,8.476
"[18, 10749]",en,Lost in Translation,"Two lost souls visiting Tokyo -- the young, neglected wife of a photographer and a washed-up movie star shooting a TV commercial -- find an odd solace and pensive freedom to be real in each other's company, away from their lives in America.",2003-09-18,Lost in Translation,7.391
"[12, 18, 10752]",en,Master and Commander: The Far Side of the World,"After an abrupt and violent encounter with a French warship inflicts severe damage upon his ship, a captain of the British Royal Navy begins a chase over two oceans to capture or destroy the enemy, though he must weigh his commitment to duty and ferocious pursuit of glory against the safety of his devoted crew, including the ship's thoughtful surgeon, his best friend.",2003-11-14,Master and Commander: The Far Side of the World,7.138
"[53, 80, 18, 9648]",en,Mystic River,The lives of three men who were childhood friends are shattered when one of them suffers a family tragedy.,2003-03-03,Mystic River,7.745
"[18, 36]",en,Seabiscuit,True story of the undersized Depression-era racehorse whose victories lifted not only the spirits of the team behind it but also those of their nation.,2003-07-22,Seabiscuit,7.012
[18],en,The Aviator,"A biopic depicting the life of filmmaker and aviation pioneer Howard Hughes from 1927 to 1947, during which time he became a successful film producer and an aviation magnate, while simultaneously growing more unstable due to severe obsessive-compulsive disorder.",2004-12-17,The Aviator,7.227
"[18, 99]",en,Finding Neverland,"During a writing slump, playwright J.M. Barrie meets a widow and her four children, all young boys—who soon become an important part of Barrie’s life and the inspiration that lead him to create his masterpiece. Peter Pan'.",2004-10-17,Finding Neverland,7.321
[18],en,Million Dollar Baby,"Despondent over a painful estrangement from his daughter, trainer Frankie Dunn isn't prepared for boxer Maggie Fitzgerald to enter his life. But Maggie's determined to go pro and to convince Dunn and his cohort to help her.",2004-12-15,Million Dollar Baby,7.951
"[18, 10402]",en,Ray,"Born on a sharecropping plantation in Northern Florida, Ray Charles went blind at seven. Inspired by a fiercely independent mom who insisted he make his own way, He found his calling and his gift behind a piano keyboard. Touring across the Southern musical circuit, the soulful singer gained a reputation and then exploded with worldwide fame when he pioneered coupling gospel and country together.",2004-10-29,Ray,7.437
"[35, 18, 10749]",en,Sideways,"Two middle-aged men embark on a spiritual journey through Californian wine country. One is an unpublished novelist suffering from depression, and the other is only days away from walking down the aisle.",2004-10-22,Sideways,7.094
"[18, 10749]",en,Brokeback Mountain,"Rodeo cowboy Jack and ranch hand Ennis are hired as sheepherders in 1963 Wyoming. One night on Brokeback Mountain, they spark a physical relationship. Though Ennis marries his longtime sweetheart and Jack marries a fellow rodeo rider, they keep up their tortured, sporadic love affair for 20 years.",2005-09-10,Brokeback Mountain,7.798
"[80, 18]",en,Capote,"A biopic of writer Truman Capote and his assignment for The New Yorker to write the non-fiction book ""In Cold Blood"".",2005-09-30,Capote,6.991
[18],en,Crash,"In post-Sept. 11 Los Angeles, tensions erupt when the lives of a Brentwood housewife, her district attorney husband, a Persian shopkeeper, two cops, a pair of carjackers and a Korean couple converge during a 36-hour period.",2005-05-06,Crash,7.227
